<?xml version="1.0" ?><ciudad xmlns="http://www.example.org/ciudad" xmlns:xsi="http://www.w3.org/2001/XMLSchema-instance" xsi:schemaLocation="http://www.example.org/ciudad ../xml/ciudad.xsd"><nombre>Cartagena</nombre><codigo>3687238</codigo><codigoPais>CO</codigoPais><nombrePais></nombrePais><poblacion>952024</poblacion><ubicacion><latitud>10.39972</latitud><longitud>-75.51444</longitud></ubicacion><bdpedia>http://dbpedia.org/resource/Cartagena%2C_Colombia</bdpedia><wikipedia>https://en.wikipedia.org/wiki/Cartagena%2C_Colombia</wikipedia><fechaActualizacion>2018-04-20</fechaActualizacion><infoMeteorologica><tiempoObservacion>2019-04-06T04:00:00</tiempoObservacion><nombreEstacion>Cartagena / Rafael Nunez</nombreEstacion><temperatura>33.0</temperatura><nubes>few clouds</nubes></infoMeteorologica><sitiosInteres><sitio><nombre>Amberes</nombre><codigo>3689976</codigo></sitio><sitio><nombre>Bruselas</nombre><codigo>3688474</codigo></sitio><sitio><nombre>Lomas de Mari√≥n</nombre><codigo>3675258</codigo></sitio><sitio><nombre>Armenia</nombre><codigo>3689554</codigo></sitio><sitio><nombre>Movich Hotel Cartagena De Indias Slh</nombre><codigo>9612088</codigo></sitio><sitio><nombre>Acueducto Cartagena</nombre><codigo>3687237</codigo></sitio><sitio><nombre>Barrio El Prado</nombre><codigo>3689126</codigo></sitio><sitio><nombre>Cartagena Water Treatment Plant</nombre><codigo>9222770</codigo></sitio><sitio><nombre>Hotel Avenida Buenos Aires</nombre><codigo>10233251</codigo></sitio></sitiosInteres></ciudad>