<?xml version="1.0" ?><ciudad xmlns="http://www.example.org/ciudad" xmlns:xsi="http://www.w3.org/2001/XMLSchema-instance" xsi:schemaLocation="http://www.example.org/ciudad ../xml/ciudad.xsd"><nombre>Beauty Spot School</nombre><codigo>4570319</codigo><pais>US</pais><poblacion>0</poblacion><ubicacion><latitud>34.06822</latitud><longitud>-79.35922</longitud></ubicacion><fechaActualizacion>2010-09-05</fechaActualizacion><infoMeteorologica><tiempoObservacion>2019-03-23T03:35:00</tiempoObservacion><nombreEstacion>MARION</nombreEstacion><temperatura>14.0</temperatura><nubes>n/a</nubes></infoMeteorologica><sitiosInteres><sitio><nombre>Bay Cemetery</nombre><codigo>4570181</codigo></sitio><sitio><nombre>Leggett Millpond Dam D-0511</nombre><codigo>4584903</codigo></sitio><sitio><nombre>Centenary Church</nombre><codigo>4574102</codigo></sitio><sitio><nombre>Leggett Mill Pond</nombre><codigo>4584902</codigo></sitio><sitio><nombre>Marion</nombre><codigo>4586272</codigo></sitio><sitio><nombre>Smith Mill Pond</nombre><codigo>4596051</codigo></sitio><sitio><nombre>Saint Marys Church</nombre><codigo>4594223</codigo></sitio><sitio><nombre>Little Reedy Creek</nombre><codigo>4585418</codigo></sitio><sitio><nombre>Terrell Bay</nombre><codigo>4598409</codigo></sitio></sitiosInteres></ciudad>