<?xml version="1.0" ?><ciudad xmlns="http://www.example.org/ciudad" xmlns:xsi="http://www.w3.org/2001/XMLSchema-instance" xsi:schemaLocation="http://www.example.org/ciudad ../xml/ciudad.xsd"><nombre>Beaver Branch</nombre><codigo>4570320</codigo><pais>US</pais><poblacion>0</poblacion><ubicacion><latitud>33.65541</latitud><longitud>-81.79955</longitud></ubicacion><fechaActualizacion></fechaActualizacion><infoMeteorologica><tiempoObservacion>2019-03-23T03:35:00</tiempoObservacion><nombreEstacion>AIKEN</nombreEstacion><temperatura>14.0</temperatura><nubes>n/a</nubes></infoMeteorologica><sitiosInteres><sitio><nombre>Green Cemetery</nombre><codigo>4580405</codigo></sitio><sitio><nombre>Kines Fork</nombre><codigo>4584052</codigo></sitio><sitio><nombre>Little Horse Creek</nombre><codigo>4585348</codigo></sitio><sitio><nombre>Sunny Brook</nombre><codigo>4597991</codigo></sitio><sitio><nombre>Bear Branch</nombre><codigo>4570230</codigo></sitio><sitio><nombre>Gopher Branch</nombre><codigo>4580110</codigo></sitio><sitio><nombre>Long Branch</nombre><codigo>4585646</codigo></sitio><sitio><nombre>Smiths Lake Dam D-2024</nombre><codigo>4596093</codigo></sitio><sitio><nombre>Smiths Lake</nombre><codigo>4596091</codigo></sitio></sitiosInteres></ciudad>