<?xml version="1.0" ?><ciudad xmlns="http://www.example.org/ciudad" xmlns:xsi="http://www.w3.org/2001/XMLSchema-instance" xsi:schemaLocation="http://www.example.org/ciudad ../xml/ciudad.xsd"><nombre>Mvané</nombre><codigo>2225705</codigo><pais>CM</pais><poblacion>0</poblacion><ubicacion><latitud>4.51667</latitud><longitud>12.13333</longitud></ubicacion><fechaActualizacion>2011-03-06</fechaActualizacion><infoMeteorologica><tiempoObservacion>2019-03-13T09:00:00</tiempoObservacion><nombreEstacion>Yaounde</nombreEstacion><temperatura>27.0</temperatura><nubes>broken clouds</nubes></infoMeteorologica><sitiosInteres><sitio><nombre>Ndakouda</nombre><codigo>2225379</codigo></sitio><sitio><nombre>Mendjuo</nombre><codigo>2227155</codigo></sitio><sitio><nombre>Bipogué</nombre><codigo>2234000</codigo></sitio><sitio><nombre>Mendibi</nombre><codigo>2227173</codigo></sitio><sitio><nombre>Mengondé</nombre><codigo>2227097</codigo></sitio><sitio><nombre>Moum</nombre><codigo>2225883</codigo></sitio><sitio><nombre>Endoum</nombre><codigo>2231945</codigo></sitio><sitio><nombre>Mellé</nombre><codigo>2227247</codigo></sitio><sitio><nombre>Nkoumoutou</nombre><codigo>2223694</codigo></sitio></sitiosInteres></ciudad>