<?xml version="1.0" ?><ciudad xmlns="http://www.example.org/ciudad" xmlns:xsi="http://www.w3.org/2001/XMLSchema-instance" xsi:schemaLocation="http://www.example.org/ciudad ../xml/ciudad.xsd"><nombre>Cartagena</nombre><codigo>2520058</codigo><pais>Spain</pais><poblacion>211996</poblacion><ubicacion><latitud>37.60512</latitud><longitud>-0.98623</longitud></ubicacion><bdpedia>http://dbpedia.org/resource/Cartagena%2C_Spain</bdpedia><wikipedia>https://en.wikipedia.org/wiki/Cartagena%2C_Spain</wikipedia><fechaActualizacion>2012-03-04</fechaActualizacion><infoMeteorologica><tiempoObservacion>2019-04-10T02:30:00</tiempoObservacion><nombreEstacion>International airport of the Region of Murcia</nombreEstacion><temperatura>18.0</temperatura><nubes>clouds and visibility OK</nubes></infoMeteorologica><sitiosInteres></sitiosInteres></ciudad>