<?xml version="1.0" ?><ciudad xmlns="http://www.example.org/ciudad" xmlns:xsi="http://www.w3.org/2001/XMLSchema-instance" xsi:schemaLocation="http://www.example.org/ciudad ../xml/ciudad.xsd"><nombre>Mvangane</nombre><codigo>2225704</codigo><pais>CM</pais><poblacion>0</poblacion><ubicacion><latitud>2.65602</latitud><longitud>11.74026</longitud></ubicacion><wikipedia>http://dbpedia.org/resource/Mvangane</wikipedia><fechaActualizacion>2011-03-21</fechaActualizacion><infoMeteorologica><tiempoObservacion>2019-03-13T09:00:00</tiempoObservacion><nombreEstacion>Bitam</nombreEstacion><temperatura>26.0</temperatura><nubes>scattered clouds</nubes></infoMeteorologica><sitiosInteres><sitio><nombre>Yem</nombre><codigo>2220912</codigo></sitio><sitio><nombre>Néléjoup</nombre><codigo>2224944</codigo></sitio><sitio><nombre>Bikong</nombre><codigo>2234150</codigo></sitio><sitio><nombre>Kong</nombre><codigo>2230068</codigo></sitio><sitio><nombre>Nko</nombre><codigo>2224119</codigo></sitio><sitio><nombre>Nkoléniong</nombre><codigo>2223993</codigo></sitio><sitio><nombre>Nkondongo</nombre><codigo>2223805</codigo></sitio><sitio><nombre>Abanga</nombre><codigo>2236127</codigo></sitio><sitio><nombre>Méboo</nombre><codigo>2227486</codigo></sitio></sitiosInteres></ciudad>