<?xml version="1.0" ?>
<ciudad xmlns="http://www.example.org/ciudad"
	xmlns:xsi="http://www.w3.org/2001/XMLSchema-instance"
	xsi:schemaLocation="http://www.example.org/ciudad ../xml/ciudad.xsd">
	<nombre>Pochinki</nombre>
	<codigo>508635</codigo>
	<pais>RU</pais>
	<poblacion>11724</poblacion>
	<ubicacion>
		<latitud>54.69875</latitud>
		<longitud>44.86678</longitud>
	</ubicacion>
	<wikipedia>http://dbpedia.org/resource/Pochinki%2C_Pochinkovsky_District%2C_Nizhny_Novgorod_Oblast</wikipedia>
	<fechaActualizacion>2012-01-17</fechaActualizacion>
	<sitiosInteres>
		<sitio>
			<nombre>Pochinkovskiy Rayon</nombre>
			<codigo>508612</codigo>
		</sitio>
		<sitio>
			<nombre>Tagayevo</nombre>
			<codigo>484899</codigo>
		</sitio>
		<sitio>
			<nombre>Novospasskoye</nombre>
			<codigo>517891</codigo>
		</sitio>
		<sitio>
			<nombre>Shishadeyevo</nombre>
			<codigo>6846126</codigo>
		</sitio>
		<sitio>
			<nombre>Styrsha</nombre>
			<codigo>6846127</codigo>
		</sitio>
		<sitio>
			<nombre>Il'inskoye</nombre>
			<codigo>557121</codigo>
		</sitio>
		<sitio>
			<nombre>Baykovo</nombre>
			<codigo>578547</codigo>
		</sitio>
		<sitio>
			<nombre>Osinki</nombre>
			<codigo>6846164</codigo>
		</sitio>
		<sitio>
			<nombre>Pos�lok Pen�kozavoda</nombre>
			<codigo>6846165</codigo>
		</sitio>
	</sitiosInteres>
</ciudad>