<?xml version="1.0" ?><ciudad xmlns="http://www.example.org/ciudad" xmlns:xsi="http://www.w3.org/2001/XMLSchema-instance" xsi:schemaLocation="http://www.example.org/ciudad ../xml/ciudad.xsd"><nombre>Cartagena</nombre><codigo>2520058</codigo><pais>ES</pais><poblacion>211996</poblacion><ubicacion><latitud>37.60512</latitud><longitud>-0.98623</longitud></ubicacion><bdpedia></bdpedia><wikipedia></wikipedia><fechaActualizacion>2012-03-04</fechaActualizacion><infoMeteorologica><tiempoObservacion>2019-02-24T04:30:00</tiempoObservacion><nombreEstacion>International airport of the Region of Murcia</nombreEstacion><temperatura>15.0</temperatura><nubes>clouds and visibility OK</nubes></infoMeteorologica><sitiosInteres><sitio><nombre>Parque Maestranza de Artilleria</nombre><codigo>10860321</codigo></sitio><sitio><nombre>Museo Histórico Militar de Cartagena</nombre><codigo>10280776</codigo></sitio><sitio><nombre>HUSA CARTAGONOVA Hotel &amp; Spa</nombre><codigo>6482678</codigo></sitio><sitio><nombre>Sercotel Alfonso XIII</nombre><codigo>6483755</codigo></sitio><sitio><nombre>Plaza San Francisco</nombre><codigo>10400375</codigo></sitio><sitio><nombre>Barrio del Foro Romano</nombre><codigo>10280774</codigo></sitio><sitio><nombre>Parque Arqueológico Cerro del Molinete</nombre><codigo>10280775</codigo></sitio><sitio><nombre>Sercotel Alfonso Xiii Ex-Best Western</nombre><codigo>10170453</codigo></sitio><sitio><nombre>SERCOTEL Carlos III</nombre><codigo>6505996</codigo></sitio></sitiosInteres></ciudad>